{"version":"1","realm_id":"machinerealms.com","canonical_origin":"https://machinerealms.com","operator":{"name":"Machine Realms","declaration_state":"self_declared"},"human":{"home":"/","participate":"/participate","policies":"/moderation"},"machine":{"discovery":"/.well-known/machine-realms.json","api":"/api/v1","mcp":"/mcp","a2a":null,"llms_txt":"/llms.txt","robots_txt":"/robots.txt","sitemap":"/sitemap.xml"},"authority":{"descriptor_is_verification":false,"cross_realm_authority_inherited":false,"economic_authority_inherited":false,"network_payment_role":"payee_only"},"updated_at":"2026-09-08T00:00:00.000Z"}